{
  "image_id": "golden-02",
  "spec_id": "chart-golden-02",
  "verdict": "pass",
  "findings": [],
  "checks_run": [
    "bar-count-matches",
    "bar-values-match-data",
    "axis-label-present",
    "axis-unit-present"
  ],
  "checks_skipped": [],
  "confidence": 0.91,
  "overlay_path": "C:\\Users\\Veerapong Laptop\\Documents\\Codex\\2026-07-09\\gi\\visual-qa-mcp\\datasets\\charts\\chart-v1\\golden\\golden-02\\overlay.png",
  "evidence_graph_path": "C:\\Users\\Veerapong Laptop\\Documents\\Codex\\2026-07-09\\gi\\visual-qa-mcp\\datasets\\charts\\chart-v1\\golden\\golden-02\\evidence_graph.json"
}