{
  "image_id": "image",
  "spec_id": "geometry-golden-04",
  "verdict": "pass",
  "findings": [],
  "checks_run": [
    "hole-count-correct",
    "hole-diameter-ratio-correct",
    "hole-alignment-correct",
    "dimension-text-correct"
  ],
  "checks_skipped": [],
  "confidence": 1.0,
  "extraction_confidence": 0.9,
  "rule_confidence": 1.0,
  "overlay_path": "datasets\\mechanical\\geometry-v1\\golden\\golden-04\\overlay.png",
  "evidence_graph_path": "datasets\\mechanical\\geometry-v1\\golden\\golden-04\\evidence_graph.json",
  "claim_graph_path": "datasets\\mechanical\\geometry-v1\\golden\\golden-04\\claim_graph.json"
}