{
  "image_id": "image",
  "spec_id": "arrow-noisy-mutated-03",
  "verdict": "fail",
  "findings": [
    {
      "id": "finding-arrow-anchor-weight",
      "rule_id": "arrow-v1.arrow-anchors-object",
      "type": "arrow_anchor_detached",
      "severity": "high",
      "message": "Arrow 'weight' tail at [389, 339] is not attached to the object region [240, 210, 360, 300] within 14 px.",
      "evidence": {
        "arrow_id": "weight",
        "tail_xy": [
          389,
          339
        ],
        "object_bbox": [
          240,
          210,
          360,
          300
        ],
        "anchor_tolerance_px": 14.0
      },
      "recommendation": "Attach the force arrow to the object it acts on."
    }
  ],
  "checks_run": [
    "arrow-count-matches",
    "required-arrows-present",
    "arrow-directions-correct",
    "arrow-anchors-object"
  ],
  "checks_skipped": [],
  "confidence": 0.8,
  "extraction_confidence": 0.9,
  "rule_confidence": 0.8,
  "overlay_path": "datasets\\physics\\arrow-v1-noisy\\mutated\\noisy-mutated-03\\overlay.png",
  "evidence_graph_path": "datasets\\physics\\arrow-v1-noisy\\mutated\\noisy-mutated-03\\evidence_graph.json",
  "claim_graph_path": "datasets\\physics\\arrow-v1-noisy\\mutated\\noisy-mutated-03\\claim_graph.json",
  "overlay_annotations": [
    {
      "finding_id": "finding-arrow-anchor-weight",
      "kind": "bbox",
      "bbox": [
        381,
        339,
        399,
        430
      ],
      "label": "weight: detached"
    }
  ]
}