{
  "image_id": "noisy-mutated-04",
  "spec_id": "chart-noisy-mutated-04",
  "verdict": "needs_review",
  "findings": [],
  "checks_run": [
    "bar-count-matches",
    "axis-scale-monotonic",
    "axis-label-present",
    "axis-unit-present"
  ],
  "checks_skipped": [
    {
      "check_id": "axis-scale-readable",
      "reason": "Optional OCR backend is not configured in the current environment."
    },
    {
      "check_id": "bar-values-match-data",
      "reason": "Every detected gridline requires a readable tick label before deriving the axis scale."
    }
  ],
  "confidence": 0.67,
  "extraction_confidence": 0.3,
  "rule_confidence": 0.67,
  "overlay_path": "datasets\\charts\\chart-v2-noisy\\mutated\\noisy-mutated-04\\overlay.png",
  "evidence_graph_path": "datasets\\charts\\chart-v2-noisy\\mutated\\noisy-mutated-04\\evidence_graph.json",
  "claim_graph_path": "datasets\\charts\\chart-v2-noisy\\mutated\\noisy-mutated-04\\claim_graph.json"
}