{
  "image_id": "mutated-03",
  "spec_id": "chart-mutated-03",
  "verdict": "needs_review",
  "findings": [],
  "checks_run": [
    "bar-count-matches",
    "axis-label-present",
    "axis-unit-present"
  ],
  "checks_skipped": [
    {
      "check_id": "axis-scale-readable",
      "reason": "Axis scale could not be derived from the available tick evidence."
    },
    {
      "check_id": "axis-scale-monotonic",
      "reason": "Tick values do not follow a consistent numeric step."
    },
    {
      "check_id": "bar-values-match-data",
      "reason": "Tick values do not follow a consistent numeric step."
    }
  ],
  "confidence": 0.84,
  "overlay_path": "C:\\Users\\Veerapong Laptop\\Documents\\Codex\\2026-07-09\\gi\\visual-qa-mcp\\datasets\\charts\\chart-v2\\mutated\\mutated-03\\overlay.png",
  "evidence_graph_path": "C:\\Users\\Veerapong Laptop\\Documents\\Codex\\2026-07-09\\gi\\visual-qa-mcp\\datasets\\charts\\chart-v2\\mutated\\mutated-03\\evidence_graph.json"
}