{
  "image_id": "image",
  "spec_id": "circuit-v1a-mutated-09",
  "verdict": "fail",
  "findings": [
    {
      "id": "finding-net-missing-battery.a-resistor.a",
      "rule_id": "circuit-v1a.terminal-netlist-correct",
      "type": "missing_net",
      "severity": "critical",
      "message": "Declared terminal net ['battery.a', 'resistor.a'] was not found.",
      "evidence": {
        "expected_terminals": [
          "battery.a",
          "resistor.a"
        ]
      },
      "recommendation": "Connect the declared terminals with one wire net."
    },
    {
      "id": "finding-net-missing-battery.b-lamp.b",
      "rule_id": "circuit-v1a.terminal-netlist-correct",
      "type": "missing_net",
      "severity": "critical",
      "message": "Declared terminal net ['battery.b', 'lamp.b'] was not found.",
      "evidence": {
        "expected_terminals": [
          "battery.b",
          "lamp.b"
        ]
      },
      "recommendation": "Connect the declared terminals with one wire net."
    },
    {
      "id": "finding-net-missing-lamp.a-resistor.b",
      "rule_id": "circuit-v1a.terminal-netlist-correct",
      "type": "missing_net",
      "severity": "critical",
      "message": "Declared terminal net ['lamp.a', 'resistor.b'] was not found.",
      "evidence": {
        "expected_terminals": [
          "lamp.a",
          "resistor.b"
        ]
      },
      "recommendation": "Connect the declared terminals with one wire net."
    },
    {
      "id": "finding-series-topology",
      "rule_id": "circuit-v1a.series-topology-correct",
      "type": "series_topology_wrong",
      "severity": "critical",
      "message": "Complete terminal-net evidence does not form one declared series loop.",
      "evidence": {
        "terminal_counts": {
          "lamp": 2,
          "battery": 2,
          "resistor": 2
        },
        "connected_components": 3
      },
      "recommendation": "Restore one closed series loop using the declared terminal netlist."
    },
    {
      "id": "finding-net-extra-battery.a-battery.b",
      "rule_id": "circuit-v1a.terminal-netlist-correct",
      "type": "extra_net",
      "severity": "high",
      "message": "Detected terminal net ['battery.a', 'battery.b'] is not declared.",
      "evidence": {
        "detected_terminals": [
          "battery.a",
          "battery.b"
        ]
      },
      "recommendation": "Remove the extra wire or declare the intended net."
    },
    {
      "id": "finding-net-extra-lamp.a-lamp.b",
      "rule_id": "circuit-v1a.terminal-netlist-correct",
      "type": "extra_net",
      "severity": "high",
      "message": "Detected terminal net ['lamp.a', 'lamp.b'] is not declared.",
      "evidence": {
        "detected_terminals": [
          "lamp.a",
          "lamp.b"
        ]
      },
      "recommendation": "Remove the extra wire or declare the intended net."
    },
    {
      "id": "finding-net-extra-resistor.a-resistor.b",
      "rule_id": "circuit-v1a.terminal-netlist-correct",
      "type": "extra_net",
      "severity": "high",
      "message": "Detected terminal net ['resistor.a', 'resistor.b'] is not declared.",
      "evidence": {
        "detected_terminals": [
          "resistor.a",
          "resistor.b"
        ]
      },
      "recommendation": "Remove the extra wire or declare the intended net."
    }
  ],
  "checks_run": [
    "component-count-matches",
    "required-components-present",
    "component-type-correct",
    "terminal-netlist-correct",
    "series-topology-correct"
  ],
  "checks_skipped": [],
  "confidence": 0.3,
  "extraction_confidence": 0.9,
  "rule_confidence": 0.3,
  "overlay_path": "D:\\visual-qa-mcp\\datasets\\physics\\circuit-v1a\\mutated\\mutated-09\\overlay.png",
  "evidence_graph_path": "D:\\visual-qa-mcp\\datasets\\physics\\circuit-v1a\\mutated\\mutated-09\\evidence_graph.json",
  "claim_graph_path": "D:\\visual-qa-mcp\\datasets\\physics\\circuit-v1a\\mutated\\mutated-09\\claim_graph.json"
}