{
  "image_id": "golden-07",
  "spec_id": "chart-golden-07",
  "verdict": "pass",
  "findings": [],
  "checks_run": [
    "bar-count-matches",
    "axis-scale-readable",
    "axis-scale-monotonic",
    "axis-zero-line-resolved",
    "bar-values-match-data",
    "axis-label-present",
    "axis-unit-present"
  ],
  "checks_skipped": [],
  "confidence": 1.0,
  "extraction_confidence": 0.87,
  "rule_confidence": 1.0,
  "overlay_path": "datasets\\charts\\chart-v2\\golden\\golden-07\\overlay.png",
  "evidence_graph_path": "datasets\\charts\\chart-v2\\golden\\golden-07\\evidence_graph.json",
  "claim_graph_path": "datasets\\charts\\chart-v2\\golden\\golden-07\\claim_graph.json"
}