{
  "image_id": "mutated-06",
  "spec_id": "chart-mutated-06",
  "verdict": "needs_review",
  "findings": [],
  "checks_run": [
    "bar-count-matches",
    "axis-scale-monotonic",
    "axis-label-present",
    "axis-unit-present"
  ],
  "checks_skipped": [
    {
      "check_id": "axis-scale-readable",
      "reason": "Axis scale could not be derived from the available tick evidence."
    },
    {
      "check_id": "bar-values-match-data",
      "reason": "Every detected gridline requires a readable tick label before deriving the axis scale."
    }
  ],
  "confidence": 0.67,
  "extraction_confidence": 0.4,
  "rule_confidence": 0.67,
  "overlay_path": "datasets\\charts\\chart-v2\\mutated\\mutated-06\\overlay.png",
  "evidence_graph_path": "datasets\\charts\\chart-v2\\mutated\\mutated-06\\evidence_graph.json",
  "claim_graph_path": "datasets\\charts\\chart-v2\\mutated\\mutated-06\\claim_graph.json"
}