{
  "image_id": "rw-public-mutated-02",
  "spec_id": "chart-rw-public-mutated-02",
  "verdict": "needs_review",
  "findings": [],
  "checks_run": [
    "bar-count-matches",
    "axis-scale-monotonic",
    "axis-label-present",
    "axis-unit-present"
  ],
  "checks_skipped": [
    {
      "check_id": "axis-scale-readable",
      "reason": "Every detected gridline requires a readable tick label before deriving the axis scale."
    },
    {
      "check_id": "bar-values-match-data",
      "reason": "Every detected gridline requires a readable tick label before deriving the axis scale."
    }
  ],
  "confidence": 0.67,
  "extraction_confidence": 0.73,
  "rule_confidence": 0.67,
  "overlay_path": "datasets\\charts\\chart-v2-realworld-pilot\\mutated\\rw-public-mutated-02\\overlay.png",
  "evidence_graph_path": "datasets\\charts\\chart-v2-realworld-pilot\\mutated\\rw-public-mutated-02\\evidence_graph.json",
  "claim_graph_path": "datasets\\charts\\chart-v2-realworld-pilot\\mutated\\rw-public-mutated-02\\claim_graph.json"
}